filename,transcription
hindi_audio1.mp3,अज्ञात रेड बैग स्टेशन पर छोडा गया है राकेश समझ गया ब्लैक कार वाले ने काम शुरू कर दिया है अज्ञात हाँ समय पर अलर्ट भेज दिया गया है राकेश ठीक है कल शाम को इंडिया गेट पर मिलते हैं
hindi_audio5.mp3,व्यक्ति एक कल रात काला पानी का रास्ता साफ कर लिया था
hindi_audio.mp3,संतोष नमस्ते रवि कैसे हो रवि अरे संतोष बढिया हूं तुम बताओ ऑफिस कैसा चल रहा है संतोष ठीक है बस इस बार दिल्ली में मीटिंग ज्यादा हो रही है रवि हाँ मैंने सुना और तुम्हारे ट्रेवल कैसे हैं संतोष सब ठीक है कल कनॉट प्लेस में था खाने का मजा लिया
hindi_audio4.mp3,व्यक्ति एक अभी चिडिया के घोंसले का नक्शा तैयार है पर ताला खोलने की चाबी कहां से लानी है व्यक्ति दो चाबी तैयार है उसे ठीक 10 बजे लाइट बंद होते ही लगाना है व्यक्ति एक और पहरेदारों का क्या कोई खास तैयारी व्यक्ति दो उनके लिए तो हम धुएं वाली चाय का इंतजाम करेंगे
hindi_audio3.mp3,व्यक्ति एक भाई वो बडा डब्बा कल रात स्टेशन पहुंच गया था चाबी वाला लडका कब मिलेगा व्यक्ति दो अभी दोपहर को मिलेगा लेकिन ध्यान रखना कि बैग पर कोई निशान न हो व्यक्ति एक ठीक है और गार्डन में लाल रोशनी देख ली थी व्यक्ति दो हाँ वो भी सही जगह पर है बस फाइनल कॉल का इंतजार है
hindi_audio2.mp3,व्यक्ति एक चिंता मत कर चौराहें पर लाल फूल का इंतजाम कर दिया है वो ही हमें सिग्नल देगा व्यक्ति दो अच्छा और ड्राइवर को क्या समझाया वो सब कुछ सही से समझ गया ना व्यक्ति एक हाँ उसको बोल दिया है कि रेसिपी का ध्यान रखें और जरा भी गड़बड�ि दो हिसाब साफ है बस अब ट्रक रवाना होते ही चाबी हमें दे देगा व्यक्ति एक ठीक है ध्यान रखना कि सफर के दौरान कोई बिल्ला न देखें व्यक्ति दो सब कवर में है अगर कुछ हुआ तो कोड रेट चालू कर देंगे