filename,transcription
hindi_audio4.mp3," व्यक्ति एक, अभी चिडिया के घोंसले का नक्षा तयार है, पर ताला खोलने की चाबी कहां से लानी है? व्यक्ति दो, चाबी तयार है, उसे ठीक दस बजे लाइट बंध होते ही लगाना है. व्यक्ति एक, और पहरेदारों का क्या? कोई खास तयारी, व्यक्ति दो, उनके लिए तो हम धुएं वाली चाय का इंतजाम करेंगे."
hindi_audio5.mp3," व्यक्ति एक, कल रात काला पानी का रास्ता साफ कर लिया था। नाव कब निकलेगी। व्यक्ति दो, रात के दो बजे। मचुआरे को सब बता दिया है। लेकिन कोई जलपरी बीच में ना आ जाए। व्यक्ति एक, अगर कुछ गडबर हो तो रेत में छुपा देना। हमारा आदमी सुबह, उठाएगा।"
hindi_audio7.mp3," व्यक्ति एक, चमकीले गुबारों का इंतजाम हो गया है। अब उनमें हवा भरने का काम बाकी है। व्यक्ति दो, हवा रात, के ग्यारह बजे भरी जाएगी। लेकिन धागा मजबूत होना चाहिए। व्यक्ति एक, और वो चमक्ति माचिस, वो टाइम पर पहुँचेगी। व्यक्ति दो, हाँ, सब सैठ है। लेकिन अगर धुआ दिखे तो तुरंत रेस से बाहर हो जाना।"
hindi_audio6.mp3," व्यक्ति एक, वो परिंदा कल शाम को अपने पिंजरे से बाहर आया था। व्यक्ति दो, समझ गया। शिकारी को निशाना बता, दिया है, क्या हतियार तैयार है। व्यक्ति एक, हाँ, वो काली किताब में हर जानकारी लिखी है। बस वक्त आने पर पन्ना पलटना है। व्यक्ति दो, ठीक है। और ये काम, पूरा होते ही सफेद कपड़ा लेकर आ जाना।"
hindi_audio3.mp3," व्यक्ति एक, भाई, वो बड़ा डब्बा कल रात स्टेशन पहुँच गया था। चाबी वाला लड़का कब मिलेगा। व्यक्ति दो, अभी दो पहर को मिलेगा। लेकिन ध्यान रखना की बैग पर कोई निशान न हो। व्यक्ति एक, ठीक है। और गार्दन में लाल रोशनी देख ली थी। व्यक्ति दो, हाँ, वो भी सही जगह पर है। बस फाइनल कॉल का इंतजार है।"
